{
  "stateName": "Kansas",
  "stateAbbr": "KS",
  "stateSlug": "kansas",
  "stateSeal": null,
  "businessEntitySearch": {
    "cta": "Search Kansas Business Entities",
    "url": "https://www.sos.ks.gov/eforms/BusinessEntity/Search.aspx"
  },
  "secretaryOfState": {
    "agency": "Kansas Secretary of State Business Services",
    "officialName": null,
    "website": "https://sos.ks.gov/businesses/businesses.html",
    "phone": "785-296-4564",
    "email": "kssos@ks.gov"
  },
  "hours": {
    "timezone": "Central Time",
    "regular": "Monday-Friday 8:00 a.m.-5:00 p.m.",
    "holidayHours": "Excluding state holidays"
  },
  "physicalAddresses": [
    {
      "label": "Kansas Secretary of State",
      "street": "Docking State Office Building, 915 SW Harrison Street",
      "city": "Topeka",
      "state": "KS",
      "zip": "66612",
      "country": "USA"
    }
  ],
  "mailingAddress": {
    "street": "Docking State Office Building, 915 SW Harrison Street",
    "city": "Topeka",
    "state": "KS",
    "zip": "66612",
    "country": "USA"
  },
  "renewals": {
    "onlineRenewalUrl": "https://www.kansas.gov/annual-reports/index.do",
    "paperRenewalUrl": null,
    "notes": "Kansas LLCs file an annual report with the Secretary of State. Online fee $53; paper $55 (Form LC fee schedule). Due after tax year end; for a calendar-year entity, between January 1 and April 15. Online: https://www.kansas.gov/annual-reports/index.do"
  },
  "corporateDocuments": {
    "operatingAgreement": null,
    "bylaws": null,
    "otherTemplates": null
  },
  "filingFacts": {
    "llcFee": 85,
    "llcFeeNotes": "Domestic Articles of Organization: $85 online / $90 paper (KS SOS Form DL fee schedule, Rev. 2/27/26).",
    "annualReport": 53,
    "annualReportDue": "Jan 1 - Apr 15 (after tax year end)",
    "nameReservation": 35,
    "nameReservationNotes": "Temporary reservation of business entity name is effective for 120 days; filing fee is $35 and reservations may not be renewed (Form NR)."
  },
  "sources": [
    {
      "name": "Official Contact Source",
      "url": "https://sos.ks.gov/about/contact-us.html",
      "lastAccessed": "2026-07-17"
    },
    {
      "name": "Official Business Services Source",
      "url": "https://www.sos.ks.gov/businesses/businesses.html",
      "lastAccessed": "2026-07-17"
    },
    {
      "name": "Official Articles of Organization Fee Source (Form DL)",
      "url": "https://www.sos.ks.gov/forms/business_services/DL.pdf",
      "lastAccessed": "2026-07-17"
    },
    {
      "name": "Official Annual Report Fee Source (Form LC)",
      "url": "https://www.sos.ks.gov/forms/business_services/lc.pdf",
      "lastAccessed": "2026-07-17"
    },
    {
      "name": "Official Information Report Source",
      "url": "https://sos.ks.gov/services/business/business.html",
      "lastAccessed": "2026-07-17"
    },
    {
      "name": "Official Name Reservation Source",
      "url": "https://sos.ks.gov/forms/business_services/NR.pdf",
      "lastAccessed": "2026-07-17"
    }
  ],
  "lastVerified": "2026-07-18"
}
