{
  "stateName": "Michigan",
  "stateAbbr": "MI",
  "stateSlug": "michigan",
  "stateSeal": null,
  "businessEntitySearch": {
    "cta": "Search Michigan Business Entities",
    "url": "https://mibusinessregistry.lara.state.mi.us/"
  },
  "secretaryOfState": {
    "agency": "Michigan Corporations Division",
    "officialName": null,
    "website": "https://www.michigan.gov/lara/bureau-list/cscl/corps",
    "phone": "517-241-6470",
    "email": "corpsmail@michigan.gov"
  },
  "hours": {
    "timezone": "Eastern Time",
    "regular": "Monday-Friday 8:00 a.m.-5:00 p.m.",
    "holidayHours": null
  },
  "physicalAddresses": [
    {
      "label": "Michigan Corporations, Securities & Commercial Licensing Bureau",
      "street": "2407 N Grand River Ave",
      "city": "Lansing",
      "state": "MI",
      "zip": "48906",
      "country": "USA"
    }
  ],
  "mailingAddress": {
    "street": "Corporations Division, P.O. Box 30054",
    "city": "Lansing",
    "state": "MI",
    "zip": "48909",
    "country": "USA"
  },
  "renewals": {
    "onlineRenewalUrl": "https://mibusinessregistry.lara.state.mi.us/",
    "paperRenewalUrl": null,
    "notes": "All Michigan LLC annual statements must be submitted online through the MiBusiness Registry Portal and are due February 15 each year after organization or qualification; fee $25 (PLLC annual is $75)."
  },
  "corporateDocuments": {
    "operatingAgreement": null,
    "bylaws": null,
    "otherTemplates": null
  },
  "filingFacts": {
    "llcFee": 50,
    "llcFeeNotes": "Domestic LLC Articles of Organization (Form 700) $50 per Corporations Division Filing Fees schedule.",
    "annualReport": 25,
    "annualReportDue": "Feb 15",
    "nameReservation": 25,
    "nameReservationNotes": "Application for Reservation of Name (Form 540) for LLC is $25 per official Filing Fees schedule; MCL 450.4205(1) holds the name to the end of the sixth full calendar month after the month of filing, which LARA's naming page rounds to 180 days. (Corporation name reservation remains $10.)"
  },
  "sources": [
    {
      "name": "Official Business Services Source",
      "url": "https://www.michigan.gov/lara/bureau-list/cscl/corps",
      "lastAccessed": "2026-07-17"
    },
    {
      "name": "Official Contact Source",
      "url": "https://www.michigan.gov/lara/about/contact-us",
      "lastAccessed": "2026-07-17"
    },
    {
      "name": "Official Address Source",
      "url": "https://www.michigan.gov/lara/bureau-list/cscl/other/corporations-division-hours-and-directions",
      "lastAccessed": "2026-07-17"
    },
    {
      "name": "Official Annual Statement Source",
      "url": "https://www.michigan.gov/lara/bureau-list/cscl/corps/michigan-business-roadmap/annual-reports-and-annual-statements",
      "lastAccessed": "2026-07-17"
    },
    {
      "name": "Official Name Reservation Source",
      "url": "https://www.michigan.gov/lara/bureau-list/cscl/corps/limited-liability-co/filing/naming-a-limited-liability-company",
      "lastAccessed": "2026-07-17"
    },
    {
      "name": "Official LLC Forms Source",
      "url": "https://www.michigan.gov/lara/bureau-list/cscl/corps/forms/limited-liability-company-forms",
      "lastAccessed": "2026-07-17"
    },
    {
      "name": "Official Filing Fee Source",
      "url": "https://www.michigan.gov/lara/-/media/Project/Websites/lara/cscl/Folder6/Filing_Fees.pdf",
      "lastAccessed": "2026-07-17"
    }
  ],
  "lastVerified": "2026-07-17"
}
