{
  "stateName": "New Hampshire",
  "stateAbbr": "NH",
  "stateSlug": "new-hampshire",
  "stateSeal": null,
  "businessEntitySearch": {
    "cta": "Search New Hampshire Business Entities",
    "url": "https://quickstart.sos.nh.gov/online/BusinessInquire"
  },
  "secretaryOfState": {
    "agency": "New Hampshire Department of State Corporation Division",
    "officialName": null,
    "website": "https://www.sos.nh.gov/corporations-0",
    "phone": "603-271-3246",
    "email": "corporate@sos.nh.gov"
  },
  "hours": {
    "timezone": "Eastern Time",
    "regular": "Walk-in customers Monday-Friday 8:30 a.m.-4:00 p.m.; telephone information line Monday-Friday 8:00 a.m.-4:30 p.m.",
    "holidayHours": null
  },
  "physicalAddresses": [
    {
      "label": "Corporation Division",
      "street": "State House Annex, Room 317, 25 Capitol Street, 3rd Floor",
      "city": "Concord",
      "state": "NH",
      "zip": "03301",
      "country": "USA"
    }
  ],
  "mailingAddress": {
    "street": "Corporation Division, N.H. Department of State, 107 North Main Street",
    "city": "Concord",
    "state": "NH",
    "zip": "03301-4989",
    "country": "USA"
  },
  "renewals": {
    "onlineRenewalUrl": "https://quickstart.sos.nh.gov/online/account",
    "paperRenewalUrl": null,
    "notes": "Annual reports due by April 1 each year after registration; report fee $100 plus $2 electronic handling if filed online (RSA 5:10-a); $50 late fee after April 1."
  },
  "corporateDocuments": {
    "operatingAgreement": null,
    "bylaws": null,
    "otherTemplates": null
  },
  "filingFacts": {
    "llcFee": 102,
    "llcFeeNotes": "Domestic LLC Certificate of Formation $100 (RSA 304-C:191; Form LLC-1). Online total $102 includes $2 electronic handling charge (RSA 5:10-a).",
    "annualReport": 102,
    "annualReportDue": "April 1",
    "nameReservation": 15,
    "nameReservationNotes": "Application for Reservation of Name $15; reserves name for 120 days (RSA 304-C:191)."
  },
  "sources": [
    {
      "name": "Official LLC Forms and Fees Source",
      "url": "https://www.sos.nh.gov/corporations-0/forms-and-fees/limited-liability-companies",
      "lastAccessed": "2026-08-06"
    },
    {
      "name": "Certificate of Formation Form LLC-1",
      "url": "https://www.sos.nh.gov/sites/g/files/ehbemt561/files/documents/2023-12/form_llc-1_-10-2018.pdf",
      "lastAccessed": "2026-07-17"
    },
    {
      "name": "Application for Reservation of Name Form 1",
      "url": "https://www.sos.nh.gov/sites/g/files/ehbemt561/files/documents/2023-11/form_1_-08-2018.pdf",
      "lastAccessed": "2026-08-06"
    },
    {
      "name": "New Hampshire RSA 304-C:191 Limited Liability Company Fees",
      "url": "https://gc.nh.gov/rsa/html/XXVIII/304-C/304-C-191.htm",
      "lastAccessed": "2026-07-17"
    },
    {
      "name": "NH QuickStart Annual Reports Portal",
      "url": "https://quickstart.sos.nh.gov/online/account",
      "lastAccessed": "2026-07-17"
    }
  ],
  "lastVerified": "2026-08-06"
}
