{
  "stateName": "Idaho",
  "stateAbbr": "ID",
  "stateSlug": "idaho",
  "stateSeal": null,
  "businessEntitySearch": {
    "cta": "Search Idaho Business Entities",
    "url": "https://sosbiz.idaho.gov/search/business"
  },
  "secretaryOfState": {
    "agency": "Idaho Secretary of State Business Services",
    "officialName": null,
    "website": "https://sosbiz.idaho.gov",
    "phone": "208-334-2301",
    "email": null
  },
  "hours": {
    "timezone": "Mountain Time",
    "regular": "Monday-Friday 8:00 a.m.-5:00 p.m.",
    "holidayHours": null
  },
  "physicalAddresses": [
    {
      "label": "Business Services",
      "street": "450 N. 4th Street",
      "city": "Boise",
      "state": "ID",
      "zip": "83702",
      "country": "USA"
    }
  ],
  "mailingAddress": {
    "street": "P.O. Box 83720",
    "city": "Boise",
    "state": "ID",
    "zip": "83720-0080",
    "country": "USA"
  },
  "renewals": {
    "onlineRenewalUrl": "https://sosbiz.idaho.gov",
    "paperRenewalUrl": null,
    "notes": "Idaho annual reports are filed through SOSbiz; the annual report is used to keep entity information current."
  },
  "corporateDocuments": {
    "operatingAgreement": null,
    "bylaws": null,
    "otherTemplates": null
  },
  "filingFacts": {
    "llcFee": 100,
    "llcFeeNotes": "Certificate of Organization base filing fee is $100 online; paper adds $20 manual processing ($120 total).",
    "annualReport": null,
    "annualReportDue": "End of anniversary month",
    "nameReservation": 20,
    "nameReservationNotes": "Application for Reservation of Legal Entity Name reserves a name for four months; base filing fee is $20, with an additional $20 manual processing fee for paper filings."
  },
  "sources": [
    {
      "name": "Official Business Services Source",
      "url": "https://sos.idaho.gov/business-services/",
      "lastAccessed": "2026-07-17"
    },
    {
      "name": "Official Office Contact Source",
      "url": "https://sos.idaho.gov/find-our-office/",
      "lastAccessed": "2026-07-17"
    },
    {
      "name": "Official Filing Fee Source",
      "url": "https://sos.idaho.gov/business-services-resources/",
      "lastAccessed": "2026-07-17"
    },
    {
      "name": "Official Business Forms Source",
      "url": "https://sos.idaho.gov/business-forms/",
      "lastAccessed": "2026-07-17"
    },
    {
      "name": "Official Annual Report Help Source",
      "url": "https://sos.idaho.gov/annual-report-help/",
      "lastAccessed": "2026-07-17"
    },
    {
      "name": "Official Name Reservation Form Source",
      "url": "https://archive.sos.idaho.gov/CORP/forms/MISC/Name%20Reservation.pdf",
      "lastAccessed": "2026-08-06"
    },
    {
      "name": "Official Certificate of Organization Form Source",
      "url": "https://archive.sos.idaho.gov/CORP/forms/LLC/LLC%20Cert%20Org.pdf",
      "lastAccessed": "2026-08-06"
    }
  ],
  "lastVerified": "2026-08-06"
}
