{
  "stateName": "Alabama",
  "stateAbbr": "AL",
  "stateSlug": "alabama",
  "stateSeal": null,
  "businessEntitySearch": {
    "cta": "Search Alabama Business Entities",
    "url": "https://www.sos.alabama.gov/government-records/business-entity-records"
  },
  "secretaryOfState": {
    "agency": "Alabama Secretary of State Business Entities Division",
    "officialName": null,
    "website": "https://www.sos.alabama.gov/business-entities",
    "phone": "334-242-5324",
    "email": null
  },
  "hours": {
    "timezone": "Central Time",
    "regular": "Monday-Friday 8:00 a.m.-5:00 p.m.",
    "holidayHours": null
  },
  "physicalAddresses": [
    {
      "label": "Business Entities Division",
      "street": "770 Washington Avenue, Suite 580",
      "city": "Montgomery",
      "state": "AL",
      "zip": "36104",
      "country": "USA"
    }
  ],
  "mailingAddress": {
    "street": "P.O. Box 5616",
    "city": "Montgomery",
    "state": "AL",
    "zip": "36103-5616",
    "country": "USA"
  },
  "renewals": {
    "onlineRenewalUrl": null,
    "paperRenewalUrl": null,
    "notes": "Corporations authorized to transact business in Alabama are no longer required by law to file an annual report with the Secretary of State."
  },
  "corporateDocuments": {
    "operatingAgreement": null,
    "bylaws": null,
    "otherTemplates": null
  },
  "filingFacts": {
    "llcFee": 200,
    "llcFeeNotes": "Domestic LLC Certificate of Formation filing fee is $200 (Ala. SOS). Name reservation is required separately ($25 paper / $28 online).",
    "annualReport": null,
    "annualReportDue": "N/A",
    "nameReservation": 28,
    "nameReservationNotes": "A name reservation is required before a domestic LLC can file its Certificate of Formation. The figure shown is the online cost of $28 for non-subscribers, which the fee schedule describes as the statutory fee plus a portal fee for the vendor. By mail the fee schedule lists $25, while the domestic request form itself offers $10 standard processing or $25 expedited."
  },
  "sources": [
    {
      "name": "Official Business Entities Contact Source",
      "url": "https://www.sos.alabama.gov/business-entities",
      "lastAccessed": "2026-07-17"
    },
    {
      "name": "LLCs page (domestic filing fees)",
      "url": "https://www.sos.alabama.gov/business-entities/llcs",
      "lastAccessed": "2026-07-17"
    },
    {
      "name": "Business Entities Division Fees (2021 schedule PDF)",
      "url": "https://www.sos.alabama.gov/sites/default/files/2022-01/2021FeeSchedule.pdf",
      "lastAccessed": "2026-08-04"
    },
    {
      "name": "Official Business Forms Source",
      "url": "https://www.sos.alabama.gov/business-entities/business-downloads",
      "lastAccessed": "2026-07-17"
    },
    {
      "name": "Official Name Reservation Fee Source",
      "url": "https://www.sos.alabama.gov/sites/default/files/2022-01/2021FeeSchedule.pdf",
      "lastAccessed": "2026-08-04"
    },
    {
      "name": "Domestic Entity Name Reservation Request Form (online non-subscriber fee $28; mailed form lists $10 standard or $25 expedited)",
      "url": "https://www.sos.alabama.gov/sites/default/files/form-files/domesticEntityNameReservation.pdf",
      "lastAccessed": "2026-08-04"
    },
    {
      "name": "Official Domestic Entity Guidance",
      "url": "https://www.sos.alabama.gov/sites/default/files/Business-Entities/Domestic%20Business%20Entities%20Brochure%202022.pdf",
      "lastAccessed": "2026-07-17"
    }
  ],
  "lastVerified": "2026-08-04"
}
