{
  "stateName": "District of Columbia",
  "stateAbbr": "DC",
  "stateSlug": "washington-d-c",
  "stateSeal": null,
  "businessEntitySearch": {
    "cta": "Search District of Columbia Business Entities",
    "url": "https://corponline.dlcp.dc.gov/homepage"
  },
  "secretaryOfState": {
    "agency": "District of Columbia Department of Licensing and Consumer Protection (DLCP) Corporations Division",
    "officialName": "Department of Licensing and Consumer Protection",
    "website": "https://dlcp.dc.gov/node/1614386",
    "phone": "202-442-4400",
    "email": "dlcp.corp@dc.gov"
  },
  "hours": {
    "timezone": "Eastern Time",
    "regular": "Monday-Friday, 8:30 a.m.-4:30 p.m. (walk-in service on select days)",
    "holidayHours": null
  },
  "physicalAddresses": [
    {
      "label": "DLCP Corporations Division",
      "street": "1100 4th Street SW",
      "city": "Washington",
      "state": "DC",
      "zip": "20024",
      "country": "USA"
    }
  ],
  "mailingAddress": {
    "street": "1100 4th Street SW",
    "city": "Washington",
    "state": "DC",
    "zip": "20024",
    "country": "USA"
  },
  "renewals": {
    "onlineRenewalUrl": "https://corponline.dlcp.dc.gov/",
    "paperRenewalUrl": null,
    "notes": "DC requires a BRA-25 biennial report: first due April 1 of the calendar year after registration, then April 1 every two years thereafter. Fee $300; late fee $100. File via CorpOnline."
  },
  "corporateDocuments": {
    "operatingAgreement": null,
    "bylaws": null,
    "otherTemplates": null
  },
  "filingFacts": {
    "llcFee": 99,
    "llcFeeNotes": "Domestic LLC Certificate of Organization (Form DLC-1): $99 (DLCP Corporations Division Fees, Limited Liability Company).",
    "annualReport": 300,
    "annualReportDue": "April 1 (biennial; first year after registration)",
    "nameReservation": 50,
    "nameReservationNotes": "Reservation or transfer of name: $50 (DLCP LLC fee schedule)."
  },
  "sources": [
    {
      "name": "DLCP Corporations Division",
      "url": "https://dlcp.dc.gov/node/1614386",
      "lastAccessed": "2026-07-17"
    },
    {
      "name": "DLCP Corporations Division Fees - Limited Liability Company",
      "url": "https://dlcp.dc.gov/node/1621921",
      "lastAccessed": "2026-07-17"
    },
    {
      "name": "DLCP Domestic Limited Liability Company",
      "url": "https://dlcp.dc.gov/node/1616716",
      "lastAccessed": "2026-07-17"
    },
    {
      "name": "DLCP Business Registration FAQs (biennial report due)",
      "url": "https://dlcp.dc.gov/page/corporations-division-business-registration-faqs",
      "lastAccessed": "2026-07-17"
    },
    {
      "name": "DC CorpOnline portal",
      "url": "https://corponline.dlcp.dc.gov/",
      "lastAccessed": "2026-07-17"
    }
  ],
  "lastVerified": "2026-07-17"
}
