{
  "stateName": "Texas",
  "stateAbbr": "TX",
  "stateSlug": "texas",
  "stateSeal": null,
  "businessEntitySearch": {
    "cta": "Search Texas Business Entities",
    "url": "https://comptroller.texas.gov/taxes/franchise/account-status/search"
  },
  "secretaryOfState": {
    "agency": "Texas Secretary of State - Business & Public Filings Division",
    "officialName": null,
    "website": "https://www.sos.state.tx.us/corp/",
    "phone": "512-463-5555",
    "email": null
  },
  "hours": {
    "timezone": "Central Time",
    "regular": "Monday-Friday, 8:00 a.m.-5:00 p.m.; lobby hours 8:30 a.m.-5:00 p.m.",
    "holidayHours": null
  },
  "physicalAddresses": [
    {
      "label": "Business & Public Filings Division Delivery Address",
      "street": "1019 Brazos St.",
      "city": "Austin",
      "state": "TX",
      "zip": "78701",
      "country": "USA"
    }
  ],
  "mailingAddress": {
    "street": "P.O. Box 13697",
    "city": "Austin",
    "state": "TX",
    "zip": "78711",
    "country": "USA"
  },
  "renewals": {
    "onlineRenewalUrl": "https://comptroller.texas.gov/taxes/file-pay/",
    "paperRenewalUrl": "https://comptroller.texas.gov/taxes/franchise/forms/",
    "notes": "Texas LLCs file annual franchise tax and public information report filings with the Comptroller, not an annual report with the Secretary of State. The annual franchise tax report is due May 15; taxable entities at or below the no-tax-due threshold still file the required information report."
  },
  "corporateDocuments": {
    "operatingAgreement": null,
    "bylaws": null,
    "otherTemplates": null
  },
  "filingFacts": {
    "llcFee": 300,
    "llcFeeNotes": "Certificate of Formation for a Texas LLC. Texas SOS Form 205 instructions list a $300 filing fee.",
    "annualReport": 0,
    "annualReportDue": "May 15",
    "nameReservation": 41.08,
    "nameReservationNotes": "An entity name may be reserved for 120 days on Form 501, and a reservation may be renewed by filing a new application during the 30 days before it expires. The filing fee is $40 for both the application and the renewal. The figure shown is the credit card total of $41.08, because the Secretary of State adds a statutorily authorized convenience fee of 2.7 percent of the total fees to card payments. Paying by personal check or money order keeps the cost at $40."
  },
  "sources": [
    {
      "name": "Texas SOS business services",
      "url": "https://www.sos.state.tx.us/corp/",
      "lastAccessed": "2026-07-17"
    },
    {
      "name": "Texas Business & Public Filings contact",
      "url": "https://www.sos.state.tx.us/corp/contact.shtml",
      "lastAccessed": "2026-07-17"
    },
    {
      "name": "Texas LLC certificate of formation instructions",
      "url": "https://www.sos.state.tx.us/corp/instructions/205.shtml",
      "lastAccessed": "2026-08-04"
    },
    {
      "name": "Texas entity name reservation instructions",
      "url": "https://www.sos.state.tx.us/corp/instructions/501.shtml",
      "lastAccessed": "2026-08-04"
    },
    {
      "name": "Texas Comptroller franchise tax",
      "url": "https://comptroller.texas.gov/taxes/franchise/",
      "lastAccessed": "2026-08-04"
    },
    {
      "name": "Texas Comptroller file and pay",
      "url": "https://comptroller.texas.gov/taxes/file-pay/",
      "lastAccessed": "2026-07-17"
    }
  ],
  "lastVerified": "2026-08-04"
}
