{
  "stateName": "Wisconsin",
  "stateAbbr": "WI",
  "stateSlug": "wisconsin",
  "stateSeal": null,
  "businessEntitySearch": {
    "cta": "Search Wisconsin Business Entities",
    "url": "https://apps.dfi.wi.gov/apps/CorpSearch/Search.aspx"
  },
  "secretaryOfState": {
    "agency": "Wisconsin Department of Financial Institutions",
    "officialName": null,
    "website": "https://dfi.wi.gov/Pages/BusinessServices/Corporations/",
    "phone": "608-261-7577",
    "email": "DFICorporations@dfi.wisconsin.gov"
  },
  "hours": {
    "timezone": "Central Time",
    "regular": "Monday-Friday, 7:45 a.m.-4:30 p.m.",
    "holidayHours": null
  },
  "physicalAddresses": [
    {
      "label": "Division of Corporate and Consumer Services",
      "street": "4822 Madison Yards Way, North Tower",
      "city": "Madison",
      "state": "WI",
      "zip": "53705",
      "country": "USA"
    }
  ],
  "mailingAddress": {
    "street": "PO Box 93348",
    "city": "Milwaukee",
    "state": "WI",
    "zip": "53293-0348",
    "country": "USA"
  },
  "renewals": {
    "onlineRenewalUrl": "https://apps.dfi.wi.gov/apps/corpar/",
    "paperRenewalUrl": null,
    "notes": "Domestic LLCs deliver an annual report each year following the calendar year of registration, during the calendar-year quarter in which the anniversary date of registration occurs (DFI FAQ). Fee: $25 online / $40 paper (DFI Corporation Fees)."
  },
  "corporateDocuments": {
    "operatingAgreement": null,
    "bylaws": null,
    "otherTemplates": null
  },
  "filingFacts": {
    "llcFee": 130,
    "llcFeeNotes": "Domestic LLC Articles of Organization: $130 online filing; $170 paper (DFI Corporation Fees schedule). Online fee confirmed on CorpFormation directions.",
    "annualReport": 25,
    "annualReportDue": "Anniversary quarter",
    "nameReservation": 15,
    "nameReservationNotes": "Name reservation for a limited liability company is $15 for 120 days (CORP1 / DFI fee practice)."
  },
  "sources": [
    {
      "name": "Wisconsin DFI business entity fees",
      "url": "https://dfi.wi.gov/Pages/BusinessServices/BusinessEntities/Fees.aspx",
      "lastAccessed": "2026-07-17"
    },
    {
      "name": "Wisconsin DFI business entity FAQ (annual report due)",
      "url": "https://dfi.wi.gov/Pages/BusinessServices/BusinessEntities/FAQ.aspx",
      "lastAccessed": "2026-07-17"
    },
    {
      "name": "Wisconsin DFI file online / LLC formation",
      "url": "https://dfi.wi.gov/Pages/BusinessServices/BusinessEntities/FileOnline.aspx",
      "lastAccessed": "2026-07-17"
    },
    {
      "name": "Wisconsin LLC online formation directions ($130)",
      "url": "https://apps.dfi.wi.gov/apps/corpformation/directions.aspx?type=12",
      "lastAccessed": "2026-07-17"
    },
    {
      "name": "Wisconsin annual report filing portal",
      "url": "https://dfi.wi.gov/apps/corpar",
      "lastAccessed": "2026-07-17"
    }
  ],
  "lastVerified": "2026-07-17"
}
