{
  "stateName": "Louisiana",
  "stateAbbr": "LA",
  "stateSlug": "louisiana",
  "stateSeal": null,
  "businessEntitySearch": {
    "cta": "Search Louisiana Business Entities",
    "url": "https://coraweb.sos.la.gov/commercialsearch/commercialsearch.aspx"
  },
  "secretaryOfState": {
    "agency": "Louisiana Secretary of State Commercial Division",
    "officialName": null,
    "website": "https://www.sos.la.gov/business-services",
    "phone": "225-925-4704",
    "email": null
  },
  "hours": {
    "timezone": "Central Time",
    "regular": "Monday-Friday 8:00 a.m.-4:30 p.m.",
    "holidayHours": null
  },
  "physicalAddresses": [
    {
      "label": "Louisiana Secretary of State Commercial Division",
      "street": "8585 Archives Ave.",
      "city": "Baton Rouge",
      "state": "LA",
      "zip": "70809",
      "country": "USA"
    }
  ],
  "mailingAddress": {
    "street": "P.O. Box 94125",
    "city": "Baton Rouge",
    "state": "LA",
    "zip": "70804-9125",
    "country": "USA"
  },
  "renewals": {
    "onlineRenewalUrl": "https://geauxbiz.sos.la.gov/",
    "paperRenewalUrl": null,
    "notes": "Louisiana business annual reports are filed through geauxBIZ; current SOS Forms & Fee Schedule lists domestic LLC annual reports at $30. Increase to $35 effective Oct 1, 2026 per Act 921 fee schedule PDF."
  },
  "corporateDocuments": {
    "operatingAgreement": null,
    "bylaws": null,
    "otherTemplates": null
  },
  "filingFacts": {
    "llcFee": 100,
    "llcFeeNotes": "Domestic Articles of Organization-Louisiana Limited Liability Company #365: $100 (current Forms & Fee Schedule; Form 365). Note: SOS announced fee increases effective Oct 1, 2026 (Articles $125, Annual Report $35), not yet in effect as of verification date.",
    "annualReport": 30,
    "annualReportDue": "Anniversary date",
    "nameReservation": 25,
    "nameReservationNotes": "Name Reservation for Corporation, Limited Liability Company, L3C and Partnership #398: $25 for 120 days."
  },
  "sources": [
    {
      "name": "Official Contact Source",
      "url": "https://www.sos.la.gov/our-office/contact-us",
      "lastAccessed": "2026-08-06"
    },
    {
      "name": "Official Commercial Division Contact Source",
      "url": "https://www.sos.la.gov/business-services/contact-us",
      "lastAccessed": "2026-08-06"
    },
    {
      "name": "Official Business Services Source",
      "url": "https://www.sos.la.gov/business-services",
      "lastAccessed": "2026-08-06"
    },
    {
      "name": "Official Forms & Fee Schedule (current)",
      "url": "https://www.sos.la.gov/business-services/forms-fee-schedule",
      "lastAccessed": "2026-08-06"
    },
    {
      "name": "Official Future Fee Schedule PDF (effective 2026-10-01)",
      "url": "https://static.sos.la.gov/shared/fee_changes_2026.pdf",
      "lastAccessed": "2026-07-17"
    },
    {
      "name": "Official File Business Documents",
      "url": "https://www.sos.la.gov/business-services/file-business-documents",
      "lastAccessed": "2026-07-17"
    }
  ],
  "lastVerified": "2026-08-06"
}
