{
  "stateName": "South Dakota",
  "stateAbbr": "SD",
  "stateSlug": "south-dakota",
  "stateSeal": null,
  "businessEntitySearch": {
    "cta": "Search South Dakota Business Entities",
    "url": "https://sosenterprise.sd.gov/BusinessServices/Business/FilingSearch.aspx"
  },
  "secretaryOfState": {
    "agency": "South Dakota Secretary of State - Business Filings Division",
    "officialName": null,
    "website": "https://sdsos.gov/business-services/",
    "phone": "605-773-4845",
    "email": null
  },
  "hours": {
    "timezone": "Central Time",
    "regular": "Monday-Friday, 8:00 a.m.-5:00 p.m.",
    "holidayHours": null
  },
  "physicalAddresses": [
    {
      "label": "Business Services",
      "street": "215 E. Prospect Ave.",
      "city": "Pierre",
      "state": "SD",
      "zip": "57501",
      "country": "USA"
    }
  ],
  "mailingAddress": {
    "street": "Capitol Building, 500 East Capitol Avenue",
    "city": "Pierre",
    "state": "SD",
    "zip": "57501-5070",
    "country": "USA"
  },
  "renewals": {
    "onlineRenewalUrl": "https://sosenterprise.sd.gov/BusinessServices/Business/AnnualReport.aspx",
    "paperRenewalUrl": null,
    "notes": "Annual reports due every year on the 1st day of the anniversary month of formation. Online LLC annual report $55; paper $70 (includes $15 paper fee)."
  },
  "corporateDocuments": {
    "operatingAgreement": null,
    "bylaws": null,
    "otherTemplates": null
  },
  "filingFacts": {
    "llcFee": 150,
    "llcFeeNotes": "Domestic LLC Articles of Organization $150 online; paper $165 including $15 paper filing fee (sdsos.gov filing fees).",
    "annualReport": 55,
    "annualReportDue": "1st day of anniversary month",
    "nameReservation": 25,
    "nameReservationNotes": "Reservation of Name $25."
  },
  "sources": [
    {
      "name": "South Dakota filing fees",
      "url": "https://sdsos.gov/general-information/filing-fees.aspx",
      "lastAccessed": "2026-07-17"
    },
    {
      "name": "South Dakota business filings contact and annual reports",
      "url": "https://sdsos.gov/business-services/corporations/contact.aspx",
      "lastAccessed": "2026-07-17"
    },
    {
      "name": "South Dakota Secretary of State contact",
      "url": "https://sdsos.gov/contact-us/default.aspx",
      "lastAccessed": "2026-07-17"
    }
  ],
  "lastVerified": "2026-07-17"
}
